id,question,prob,resolution,calibration_err,brier,nr_bettors,volume,attention_q,avg_bet
EtcI8g8tgZ,Will the U.S. Department of Justice open a formal investigation into Elon Musk or any of his companies before 1/1/26?,0.1441748108692378,0,0.1441748108692378,0.0207863760891805,8,206.3534989908614,Q1_retail,25.794187373857675
Dd03Pd8RjdsAgTfwrfzU,Will a Neuralink device be implanted in a human brain by the end of 2024?,0.99,1,0.01,0.0001,226,212471.54136828423,Q4_sophisticated,940.139563576479
ndJNTZ68TsphAhWsz2xl,Will a device from Neuralink receive FDA approval in 2023 for implantation in a human?,0.92,1,0.0799999999999999,0.0063999999999999,159,31885.971211392232,Q2_small,200.54069944271845
zX320t6B0TMjCa9GPzze,Will Neuralink implant a device into a human’s brain by the end of 2024?,1.0,1,0.0,0.0,159,177152.19801850888,Q4_sophisticated,1114.1647674120054
eAtIJcMyZcBsmVX25I7B,Will there be any groundbreaking discovery regarding transhumanism in the next 30 days.,0.02,0,0.02,0.0004,72,5959.262606568506,Q1_retail,82.76753620234037
vFJBlyzQd8Nr7dxcicq0,"Will Neuralink be implemented into the human brain by May 31, 2023?",0.01,0,0.01,0.0001,59,12714.38743974692,Q3_large,215.49809219910034
CtFV2OdqIhUGTLYdkrxq,Will a human use Neuralink to transmit at least 4 bits per second?,0.98,1,0.02,0.0004,42,17131.631728915523,Q3_large,407.89599354560767
w7BVXejunIHlMR0kgn69,Will Musk’s Neuralink be charged penalties for violations of the Animal Welfare Act?,0.08,0,0.08,0.0064,41,4892.72499502468,Q2_small,119.3347559762117
jFwweVAK2GKMnIYdq4TY,Will Elon Musk merge Neuralink with a competitor and give up control of the new entity by the end of 2022?,0.01,0,0.01,0.0001,34,3146.813730416684,Q1_retail,92.5533450122554
iTrrxdYoJKdHCiwdj7Wo,Will Neuralink IPO by the end of 2024?,0.01,0,0.01,0.0001,33,7715.466429239203,Q3_large,233.80201300724858
dF3E06SntxHrRgVjurG4,"Will Elon Musk be revealed to be an evil sentient rodent named ""Elongated Muskrat""  by the end of 2023?",0.01,0,0.01,0.0001,32,2136.141529839855,Q1_retail,66.75442280749547
PtuzXMReveqyA51RP1OC,"Will Neuralink begin recruitment for the clinical trial of its brain implants by the end of Jul 15, 2023?",0.03,0,0.03,0.0009,30,6594.166564855298,Q3_large,219.80555216184328
UoMoa77KkF1E6AWfzOSY,Will Neuralink begin testing its neural chip in humans by the end of 2023?,0.0,0,0.0,0.0,28,10912.962260527034,Q3_large,389.7486521616798
Lg7UO1WsUOZ70ckTg7iG,Will Neuralink conduct human trials by the end 2022?,0.05,0,0.05,0.0025,27,693.9059860777725,Q1_retail,25.700221706584166
80eaac0jYluzZ7PZGYf0,Will Sam Altman be CEO of any Elon Musk owned company by the end of 2024?,0.01,0,0.01,0.0001,27,6095.061752161293,Q3_large,225.74302785782567
0R4nvTUPwRrhnvO0tsBu,Will Neuralink's FDA study appear on clinicaltrials.gov in 2024?,0.99,1,0.01,0.0001,26,12634.437885059064,Q4_sophisticated,485.9399186561178
rRYogIM0PNXQmRQile6G,"Will Neuralink begin recruitment for the clinical trial of its brain implants by the end of Sep 15, 2023?",0.02,0,0.02,0.0004,22,8505.404667712795,Q3_large,386.60930307785435
zoqFNIDPXPyMf1DDN5lg,Will Shivon Zilis be the next CEO of Twitter?,0.01,0,0.01,0.0001,22,7065.7030641919455,Q3_large,321.1683210996339
6efDQN1o7Atzskkvw0CC,Will Tesla's Optimus robot be controlled during a live demo by a primate using a Neuralink brain implant during Tesla AI Day?,0.0282801105867621,0,0.0282801105867621,0.0007997646547994,19,2136.5330490775204,Q2_small,112.44910784618529
H3ZqQ48ncMo0zOVqQDoC,"Will Neuralink begin recruitment for the clinical trial of its brain implants by the end of Jun 15, 2023?",0.0,0,0.0,0.0,18,8854.347182766563,Q4_sophisticated,491.90817682036464
DqcO3ncl41HkAMsBo0K9,"Will Neuralink announce they have begun a human trial at their November 30 ""show and tell"" event?",0.0991477190673918,0,0.0991477190673918,0.0098302701962664,18,1352.599386434402,Q1_retail,75.14441035746678
SsK1zEjdmAswQtM54bYq,"Will Neuralink begin recruitment for the clinical trial of its brain implants by the end of Aug 15, 2023?",0.0,0,0.0,0.0,15,6973.407080000359,Q4_sophisticated,464.8938053333573
WB0VyaSS92d8Y9lZh5qX,Will Neuralink reveal a vision implant at today's show and tell event?,0.5200000000000007,1,0.4799999999999993,0.2303999999999993,14,1080.8873615577163,Q1_retail,77.20624011126544
Hlnpoq9BN7dy8OdErO7X,Will Neuralink showcase a monkey on stage by the end of 2024?,0.0747223590118492,0,0.0747223590118492,0.0055834309362956,14,1117.000348433506,Q1_retail,79.78573917382185
s2i8y2m2oh,Will Neuralink implant its device in five or more patients before the end of 2024?,0.08285606087759,0,0.08285606087759,0.0068651268241509,14,2839.529700673035,Q2_small,202.82355004807394
CyTjWHamGWfkq22IomVb,Will pictures/videos of any animals that died in the course of testing by Neuralink become publicly available in 2024?,0.1077190905000387,0,0.1077190905000387,0.0116034024581555,12,334.7780001726948,Q1_retail,27.8981666810579
PByaDhdalv0PmHjrF4se,"Will I get an job-interview for an AI safety position prior to the 1, March, 2024?",0.6567652264039514,0,0.6567652264039514,0.4313405626134335,12,345.3842072158181,Q1_retail,28.78201726798484
7bxwaLt1fN0nSeKlbJtR,Will Elon Musk's Neuralink implant its chip in humans by the end of 2022 as planned?,0.04,0,0.04,0.0016,11,602.2200811512494,Q1_retail,54.74728010465903
FxI5z24LG3PbnxJm8rtO,Will Neuralink IPO in 2023?,0.04,0,0.04,0.0016,7,442.0,Q1_retail,63.142857142857146
BOkT1rnnC0uTrEbXHZi4,Will any of these occur during Tesla AI Day?,0.16,0,0.16,0.0256,6,214.7985692460901,Q1_retail,35.799761541015016
38vJy3PkN7vB8Gj7UH24,"Will recruitment be the goal of the next Neuralink broadcast on Nov 30, 2022 - 6 pm PT ?",0.84369442515266,1,0.1563055748473399,0.0244314327283574,3,146.0,Q1_retail,48.666666666666664
QJ3DKC4MaXxONfEhxXNG,"Will ""Will a device from Neuralink receive FDA approval in 2023 for implantation in a human?"" resolve N/A?",0.85,0,0.85,0.7224999999999999,1,70.0,Q1_retail,70.0
LyO08csNE0,Starship Flight 10 will launch before New Glenn Flight 2,0.99,1,0.01,0.0001,16,13585.957062147418,Q4_sophisticated,849.1223163842136
ygupptyPgp,Will the booster be caught during Starship Flight 10?,0.0113274546156137,0,0.0113274546156137,0.0001283112280687,19,10757.629709806452,Q4_sophisticated,566.1910373582343
ELpZgCNucs,Will the Starship flight 10 ship be caught?,0.01,0,0.01,0.0001,15,3436.135510766625,Q3_large,229.075700717775
Pt5Elln99I,Will the Starship Flight 9 ship be caught?,0.01,0,0.01,0.0001,14,2271.5242801756604,Q2_small,162.25173429826145
H6UfRFm8sqjaJllJPfKk,Will Starship conduct a manned launch before 2025?,0.0131832876104497,0,0.0131832876104497,0.0001737990722198,39,10774.07441378916,Q3_large,276.25831830228617
NlhnnOq0sI,Starship flight 10 soft touchdown?,0.4928737153959791,1,0.5071262846040209,0.2571770685362783,111,13565.04786082126,Q2_small,122.20763838577712
5yEyp26LpZ,Starship flight 9 soft touchdown?,0.01,0,0.01,0.0001,27,14089.230457396694,Q4_sophisticated,521.8233502739516
dO2zcQldUd,Will Artemis II fly before Starship Flight 12?,0.99,1,0.01,0.0001,62,29641.72784333979,Q4_sophisticated,478.0923845699966
gLgq9AClpl,Starship Flight 10 successfully deploys a payload?,0.99,1,0.0099999999999998,9.999999999999796e-05,14,1717.8042500293454,Q2_small,122.70030357352468
5LNyRSu9gc,Will the booster on Starship Flight 11 complete its new landing burn successfully?,0.9819800091988448,1,0.0180199908011552,0.0003247200684737,5,6382.0,Q4_sophisticated,1276.4
cP2ud96gdp,Starship IFT10 scrubs third consecutive time today?,0.0393648489856772,0,0.0393648489856772,0.0015495913356651,5,516.0,Q2_small,103.2
8aeEr0wFAYoRhdKIa2U1,Will Starship reach escape velocity before 2026?,0.0087753029940451,0,0.0087753029940451,7.70059426372976e-05,47,29485.40315485253,Q4_sophisticated,627.3490032947346
RhGdUWAAwh63mhVBBUqx,Will New Glenn launch a commercial payload before Starship?,0.9946380407917949,1,0.0053619592082051,2.8750606550455967e-05,56,14652.147442651934,Q3_large,261.64549004735596
qeyHi6sQyWsrX2LJWQhN,Will Starship launch to orbit at least 8 times before the end of 2025?,0.01,0,0.01,0.0001,20,2193.023364772262,Q2_small,109.65116823861311
Dm1VtCG9Ad5UloIrw8od,Will two Starships dock together in orbit before 2026?,0.0005309997958477,0,0.0005309997958477,2.8196078319033974e-07,133,65903.51849744726,Q4_sophisticated,495.5151766725358
Gt3wsyXp1ECaEQyllI7q,Will Starship launch to orbit at least 6 times before the end of 2025?,0.0085223640604404,0,0.0085223640604404,7.263068917868665e-05,42,8397.121508734608,Q2_small,199.93146449368115
tNcE96ZU8O,Starship's next three flights each launch within six weeks of prior?,0.0099999999999999,0,0.0099999999999999,9.999999999999956e-05,17,10332.181057114032,Q4_sophisticated,607.7753563008255
IQPtOS2SEZ,Will Starship Flight 9 re-fly a booster?,0.9896721241504984,1,0.0103278758495016,0.0001066650195627,16,10592.57221257264,Q4_sophisticated,662.03576328579
GZi0GilGmGl84OY1Q0Vp,Will Starship go to the Moon before 2026?,0.01,0,0.01,0.0001,75,14749.00820939234,Q2_small,196.65344279189785
eOMm60H6mfrEMV8jytB3,Will Starship refuelling be solved by end of 2025?,0.009135265399916,0,0.009135265399916,8.345307392690402e-05,41,10718.201267605964,Q3_large,261.4195431123406
xyyGAgEarYCL3EVuOuTH,Will Starship launch to orbit at least 7 times before the end of 2025?,0.0087109523796272,0,0.0087109523796272,7.588069136013376e-05,37,10075.07352517437,Q3_large,272.29928446417216
SLUd596tz0,Will a Starship upper stage with Raptor 2 engines ever be caught successfully?,0.0097473390594048,0,0.0097473390594048,9.501061873899892e-05,14,20543.09092143924,Q4_sophisticated,1467.3636372456601
THPsMRwQWcaZttCDbZvv,Will Starship IFT-4 survive past the point of maximum re-entry heating?,0.56,1,0.4399999999999999,0.1935999999999999,530,306811.1861788096,Q4_sophisticated,578.8890305260559
IE13cIaria26hm3jlg6U,Will Starship reach space in 2023?,0.99,1,0.01,0.0001,409,289506.73514729005,Q4_sophisticated,707.840428232983
OW87rfaMlMJGfQkZCluJ,Will a Starship orbital flight attempt occur in September 2023?,0.0,0,0.0,0.0,370,183489.7308240769,Q4_sophisticated,495.918191416424
VNtFo8wagn8zWPO8AnDP,Will a Starship orbital flight attempt occur in November 2023?,1.0,1,0.0,0.0,305,166463.20092943346,Q4_sophisticated,545.7809866538802
XMW0oKl5yPOkllCjXbFU,Will a Starship orbital flight attempt occur in October 2023?,0.0,0,0.0,0.0,214,88931.93939528386,Q3_large,415.5698102583358
oYRWylU1Fx0mZtAygnju,Will the next Starship Orbital Launch attempt occur before the end of September 2023?,0.0,0,0.0,0.0,189,114048.38628737105,Q4_sophisticated,603.4306152770955
lp5RyDlEAr517imOyPiw,Will another Starship launch attempt be made in Q3 2023?,0.0,0,0.0,0.0,136,94379.95182675302,Q4_sophisticated,693.9702340202429
fY9d3GmvIXXK6Mw8ysIN,Will the next full stack launch of Starship (after 4/20) occur before the end of 2023?,1.0,1,0.0,0.0,119,88544.62420258072,Q4_sophisticated,744.0724722905942
sg4FKVco9ytsufNcNJKQ,"Will the next full stack launch of starship (after 4/20), occur before the end of November?",0.99,1,0.01,0.0001,114,91439.31562758096,Q4_sophisticated,802.099259891061
akoaxu6i4WV4iSwbDqmo,Will the first attempt to catch a starship booster with Mechazilla result in the booster exploding,0.01,0,0.01,0.0001,112,21484.22782221032,Q2_small,191.82346269830643
rZctGtA62d0PbLrN2Ywp,Will Starship launch in February 2024,0.0,0,0.0,0.0,110,57852.31559572845,Q4_sophisticated,525.9301417793495
KHQk7RFuQHKTgvBlqmTb,Will the next Starship Orbital Launch attempt occur before the end of August 2023?,0.0,0,0.0,0.0,105,81058.12640320158,Q4_sophisticated,771.9821562209673
xrJ3DYQMgpxvDguXGI2u,Will the Starship orbital test flight be successful?,0.04,0,0.04,0.0016,99,12891.702407705783,Q2_small,130.21921623945235
IcZZqwDg8Msq7sR10EPY,Will two Starships dock together in orbit before 2025?,0.0099999999999999,0,0.0099999999999999,9.999999999999976e-05,94,97083.60861653196,Q4_sophisticated,1032.8043469843826
4lZDSBZBp6MUA0dLvIEa,"Will a Starship orbital flight attempt occur on November 17th, 2023?",0.0,0,0.0,0.0,91,72748.74567998553,Q4_sophisticated,799.4367657141266
hvMtUWKbIauWXduYCanl,Will the next Starship Orbital Launch attempt occur before the end of July 2023?,0.01,0,0.01,0.0001,84,24808.917269184112,Q3_large,295.34425320457274
szsuZ26tUQ,Will Starship Flight 7 fly before New Glenn’s Maiden flight?,0.0062188262908383,0,0.0062188262908383,3.867380043562269e-05,81,64579.64469568157,Q4_sophisticated,797.2795641442169
y3FGB5RkeDI3ZRV3us5L,Will Starship launch at least 5 times in 2024?,0.0099999999999999,0,0.0099999999999999,9.99999999999999e-05,81,57410.950089652375,Q4_sophisticated,708.7771616006467
WIMxbSddBuZF10yo8loM,Will Starship launch in March 2024,0.99,1,0.01,0.0001,80,31579.647607380102,Q3_large,394.7455950922513
dn7rmj2w6n2g55N09B69,Will a Starship orbital flight attempt occur in December 2023?,0.0,0,0.0,0.0,80,90814.65112789342,Q4_sophisticated,1135.1831390986677
kvk7PJbRQTYwOyugVZRX,Will Starship launch in January 2024,0.01,0,0.01,0.0001,79,45424.34023741776,Q4_sophisticated,574.9916485749084
9yUr4o1BgrvMSXPTY6Nk,"Will a Starship orbital flight attempt occur on April 20th, 2023?",0.99,1,0.01,0.0001,78,38873.56080947326,Q4_sophisticated,498.3789847368367
0cfgczc7PWTxxQMkVMHd,Will another Starship successfully launch before 2024?,0.95,1,0.05,0.0025,72,12247.310032722951,Q2_small,170.1015282322632
9jmq5qAaWSJaGH8ejhLh,Will a Starship orbital flight test occur by the end of March?,0.02,0,0.02,0.0004,72,20819.72271901479,Q3_large,289.1628155418721
wgzjdBXeZNVlyML921TY,Will the next Starship Orbital flight attempt occur before September 16th?,0.0,0,0.0,0.0,70,64542.39285309472,Q4_sophisticated,922.0341836156389
jbRuvzPiqG3QXnBQ1XAV,"Will a Starship orbital flight attempt occur on April 17th, 2023?",0.98,1,0.02,0.0004,70,36768.56037792269,Q4_sophisticated,525.2651482560384
PpfD2hkOxqO2fXwzm48D,Will a Starship orbital flight attempt occur in August 2023?,0.01,0,0.01,0.0001,69,42037.35440853705,Q4_sophisticated,609.2370204135805
C2J23KkfC6cJCPaCz1sy,Will Starliner fly before Starship IFT-4?,0.99,1,0.01,0.0001,64,45324.22647235364,Q4_sophisticated,708.1910386305257
ewj2yf24e4,Will there be a 6th Starship launch before end of 2024?,0.9904301971001,1,0.0095698028999,9.15811275429356e-05,62,29638.397703304363,Q4_sophisticated,478.03867263394136
Hna8LSuNDcvK7MS5OBgV,Will Starship reach orbit by the end of 2022?,0.02,0,0.02,0.0004,59,5535.21424160072,Q2_small,93.81719053560542
uj3hqoioir,Will there be a 5th Starship launch on or before October 15?,0.99,1,0.01,0.0001,58,18245.545727369656,Q3_large,314.57837460982165
3gwlMJi6gE2vqICoV9ko,Will Starship’s hot-staging work on the first try?,0.75,1,0.25,0.0625,57,12199.655476257043,Q3_large,214.02904344310602
72aE6Up2qzaD3UU6XoFv,21. Will Starship reach orbit in 2022?,0.02,0,0.02,0.0004,57,6142.510887409314,Q2_small,107.7633489019178
pPRdNAZ22Z,Will the super heavy booster for Starship Flight 7 be caught?,0.9923008497826714,1,0.0076991502173285,5.9276914068990833e-05,54,15510.34798815745,Q3_large,287.2286664473602
gbk4Av7VpKZ5BBcAbUTB,Will the next Starship Orbital Launch attempt occur before the end of October 2023?,0.0,0,0.0,0.0,54,25033.063348683776,Q4_sophisticated,463.5752471978477
YGD75pEOz75IQy5MsCka,Will a Starship orbital flight test occur by the end of April?,0.99,1,0.01,0.0001,53,18382.422921676807,Q3_large,346.83816833352466
Rl9Ml46y0qvnMqOryIkZ,Will the 5th Starship test survive reentry?,0.99,1,0.01,0.0001,53,139522.63110790317,Q4_sophisticated,2632.5024737340223
qrrqMws7KyGMjuNct1Y9,Will Starship–Super Heavy deliver a payload to orbit in 2024?,0.01,0,0.01,0.0001,51,8252.252691982765,Q2_small,161.80887631338754
dqOnP95AlTt6JJPOPho8,"Will the next full stack launch of starship (after 4/20), occur before the end of August?",0.01,0,0.01,0.0001,51,33019.56832738017,Q4_sophisticated,647.4425162231406
3yWPBLq5T2PJSR0Duddg,Will Starship undergo a static fire test of all 33 engines by Feb 14?,0.02,0,0.02,0.0004,50,14496.055879469726,Q3_large,289.9211175893945
MlPWxUaVsQmeRbQ2iF92,Will the shape of Starship's flaps have obvious visual changes for IFT5?,0.01,0,0.01,0.0001,47,99719.61008262722,Q4_sophisticated,2121.69383154526
gn58tCuClU,Trump gives Elon a nickname by EOD Saturday?,0.1237435016539438,0,0.1237435016539438,0.0153124542015796,26,1219.632858965706,Q1_retail,46.90895611406562
uZhps8UlRR,Elon out of Trump administration before July?,0.963021987685286,1,0.0369780123147139,0.0013673733947471,41,18974.14236482769,Q4_sophisticated,462.78396011774856
llC0sSgzg8,"Will Trump & Elon cut >250,000 government employees in 2025?",0.99726092350404,1,0.0027390764959599,7.50254005072022e-06,1484,2404999.674900164,Q4_sophisticated,1620.6197270216737
NAgQ5O6Lt6,Will Elon & Trump have a major falling out by EoY 2025?,0.9826600480940502,1,0.0173399519059498,0.0003006739321006,63,15461.843790237524,Q3_large,245.42609190853213
dRAz5UdAE9,Will Dwarkesh interview Elon by mid 2026,0.99,1,0.01,0.0001,19,15065.634864147094,Q4_sophisticated,792.928150744584
g29EUpghLn,Elon appears in a tell-all podcast before end of July-2025?,0.0145383176796689,0,0.0145383176796689,0.0002113626809549,35,9806.526950795982,Q3_large,280.1864843084566
IqP9EZ5dU0,Trump gives Elon a nickname by end of July?,0.01593734385971,0,0.01593734385971,0.0002539989293026,485,100428.43267937088,Q3_large,207.0689333595276
qQs5OgnU5n,Will Elon call Trump retarded by the end of 2025?,0.0128496651207357,0,0.0128496651207357,0.000165113893715,24,1800.6214403226895,Q1_retail,75.02589334677873
hysIO9s9nP,Will Elon visit the White House again by the end of 2025?,0.9617376069027072,1,0.0382623930972928,0.0014640107255317,14,746.0129595548178,Q1_retail,53.28663996820127
N8ln0A92yu,Will Elon visit mar a lago again by the end of 2025?,0.039545197476794,0,0.039545197476794,0.0015638226434786,11,519.0811874914134,Q1_retail,47.18919886285576
50ERsZcuAC,Will >90% of Elon re/tweets/replies on 19 December 2025 be about AI risk?,0.0151567740448867,0,0.0151567740448867,0.0002297277994477,9,891.6666666666663,Q2_small,99.07407407407403
8Ad8yLhyPd,Will Elon do another suspiciously Roman looking salute by end of 2025?,0.0368058909941438,0,0.0368058909941438,0.0013546736118727,48,9655.243787603864,Q2_small,201.15091224174716
UUtCqt9u8q,Did Trump punch Elon?,0.0326048920858857,0,0.0326048920858857,0.0010630789879322,23,5520.51837809262,Q3_large,240.02253817794
ZQZ62dAClL,Tesla launches driverless Robotaxi service before August?,0.0195358737600957,0,0.0195358737600957,0.0003816503635703,23,7768.476622972511,Q3_large,337.7598531727179
9Up2O6sQUN,Will Robotaxis roll out in Austin as planned?,0.1024743199843982,0,0.1024743199843982,0.0105009862562648,74,12382.409845211843,Q2_small,167.32986277313302
ZZlp9lhQqE,Will OpenAI launch or buy out a social media network by Jan 2028?,0.9648552537630116,1,0.0351447462369884,0.0012351531880623,17,867.9999999999997,Q1_retail,51.05882352941175
vt0szbY7IDWkBS3bhIZ7,Will Elon Musk release a phone before 2026?,0.01,0,0.01,0.0001,20,9405.391622193743,Q4_sophisticated,470.2695811096872
ht5yqnRI65,Will Tesla release a full level 4 autonomy car in any place before the end 2025?,0.068544145075868,0,0.068544145075868,0.0046982998241816,17,1052.8397719417317,Q1_retail,61.9317512906901
NSRE6SpPc0,xAI launches its own browser by EOY2025?,0.01,0,0.01,0.0001,16,1392.214932241468,Q1_retail,87.01343326509175
1uLOu6I8BmKuNa2QNJR7,Will Chevrolet deliver the Silverado EV to the general public before the Tesla Cybertruck.,0.08,0,0.08,0.0064,63,5889.82968816407,Q2_small,93.4893601295884
4daue931qf,Will the 5th Starship test launch by end of July?,0.0,0,0.0,0.0,39,50869.12677969513,Q4_sophisticated,1304.336584094747
Cc6bQTBOtcb4l9tIH1DM,Will Elon Musk be indicted for any crimes before the end of 2023?,0.01,0,0.01,0.0001,36,12401.749151703396,Q3_large,344.493031991761
jUjkNJIijIFmvOLDrUxI,Will SpaceX launch IFT-3 by March AND successfully demonstrate in-orbit propellant transfer?,0.0,0,0.0,0.0,31,17811.827369563496,Q4_sophisticated,574.5750764375322
AEg9EPiDc0l7SlB1E1T5,Will Carmack head Elon’s new AI company?,0.03,0,0.03,0.0009,28,7234.611158496351,Q3_large,258.37896994629824
CuEWG3hnJ56KeWfbIjTs,Will a Starship orbital flight test occur by the end of November?,0.0247138953403892,0,0.0247138953403892,0.0006107766228957,26,3884.803073442446,Q2_small,149.41550282470945
8MwF5OZZRTWth9GLOtes,Will SpaceX launch a nine-engine Starship variant in 2024?,0.0099548470847697,0,0.0099548470847697,9.909898048114906e-05,23,9022.146703991457,Q3_large,392.2672479996286
q5Tz0Ity1bSDshnRV3Ik,"6) Efforts to develop humanoid robots will attract considerable attention, funding and talent. Several new humanoid robot initiatives will launch.",0.69,1,0.31,0.0961,23,1266.7047981048377,Q1_retail,55.074121656732075
NvkDDzWsOLk3KDCvkt9a,"Will Starship launch successfully before Monday, May 1st, 2023?",0.99,1,0.01,0.0001,20,16765.87283436217,Q4_sophisticated,838.2936417181085
kct7b2p3MToHm708Usy7,Will SpaceX launch IFT-3 by June AND successfully demonstrate in-orbit propellant transfer?,0.01,0,0.01,0.0001,18,8454.571189733626,Q4_sophisticated,469.69839942964586
uek9NyKDb6jjh6HFnSZ5,Will Starship blow up on the pad this week?,0.01,0,0.01,0.0001,16,4559.124358131515,Q3_large,284.9452723832197
Bm7bXTK4Ixind2Ib8NlQ,Will SpaceX launch IFT-3 by December AND successfully demonstrate in-orbit propellant transfer?,0.0,0,0.0,0.0,15,6724.950879496076,Q3_large,448.3300586330717
uqnrBHCexa9ZvZhlReVP,Will SpaceX launch IFT-3 by April AND successfully demonstrate in-orbit propellant transfer?,0.0,0,0.0,0.0,14,8600.334830010508,Q4_sophisticated,614.3096307150363
kmGMFSFLqs7RCYxwUEmu,Will Musk be part of a significant event worthy of media coverage by the main media outlets during the week of 1st to 7th of August?,0.1017680764939834,0,0.1017680764939834,0.0103567413932852,14,550.8953994271639,Q1_retail,39.34967138765456
TvPvbgvqdcbIn8uo5yuP,Can Chat-GPT be used to describe arbitrary texts in a compressed form?,0.82,1,0.18,0.0324,13,1064.5341832581912,Q1_retail,81.88724486601471
Zox4dPdZSSY4Z98LpSQo,Will SpaceX launch IFT-3 by May AND successfully demonstrate in-orbit propellant transfer?,0.0,0,0.0,0.0,13,8520.32209812996,Q4_sophisticated,655.4093921638431
1UKReeWafmtuzzml7rH5,Will SpaceX launch IFT-3 by July AND successfully demonstrate in-orbit propellant transfer?,0.01,0,0.01,0.0001,13,4370.279225379447,Q3_large,336.17532502918823
QGgfukTiGRZTo5ACvSRW,Will SpaceX launch IFT-3 by February AND successfully demonstrate in-orbit propellant transfer?,0.0,0,0.0,0.0,12,7283.336841731729,Q4_sophisticated,606.9447368109774
RcsnSEgsu0,Will Trump or Elon acknowledge the Trumpets of Patriots before the 2025 Australian election?,0.014828229375412,0,0.014828229375412,0.0002198763864098,10,7904.448691772091,Q4_sophisticated,790.4448691772091
QkPbYZjTW7JLBh6L82LG,Will SpaceX launch IFT-3 by August AND successfully demonstrate in-orbit propellant transfer?,0.0,0,0.0,0.0,10,6133.362965537951,Q4_sophisticated,613.3362965537951
V4VovIJOG3X6SKIOZyy0,Will Starship blow up on the pad today?,0.01,0,0.01,0.0001,10,2123.028553850644,Q3_large,212.30285538506442
cculy81nxCCunbR4nZB9,Will SpaceX attempt to employ hot staging in the next Starship–Superheavy flight test?,1.0,1,0.0,0.0,10,42120.15021930583,Q4_sophisticated,4212.015021930583
cJrwXuCwGOjvristly9e,Will SpaceX launch IFT-3 by November AND successfully demonstrate in-orbit propellant transfer?,0.0,0,0.0,0.0,8,4268.215199783231,Q4_sophisticated,533.5268999729038
1U0azDf5pSXf93D3Cx03,Will SpaceX launch IFT-3 by October AND successfully demonstrate in-orbit propellant transfer?,0.0,0,0.0,0.0,7,4080.373598446272,Q4_sophisticated,582.9105140637531
I8VQ2uiuarY2lNJLUO6V,Will SpaceX launch IFT-3 by September AND successfully demonstrate in-orbit propellant transfer?,0.0,0,0.0,0.0,6,3096.2492920510977,Q4_sophisticated,516.041548675183
jbrmhbfszr,Will the US government announce new fines against SpaceX this year?,0.3076923076923079,0,0.3076923076923079,0.0946745562130178,3,50.0,Q1_retail,16.666666666666668
50dA2Q2gqc,"Tesla to release Model Y variant below $40,000 in the US in October 2025?",0.7857646297703438,1,0.2142353702296562,0.0458967938574378,11,436.3794536662465,Q1_retail,39.670859424204224
N9uhthpS8h,Did Tesla defraud the Canadian government by falsifying sales figures in January 2025?,0.01,0,0.01,0.0001,25,5584.703793542718,Q3_large,223.38815174170873
LOdMR4HFQYPqzMHR5JpP,"Will Tesla Vehicle deliveries Q4 2023 exceed 500,000?",0.0,0,0.0,0.0,76,44834.51627486992,Q4_sophisticated,589.9278457219726
UWo4AxtUOh49Us6AITkW,Will Tesla sell its first Semi in 2022?,0.9013167463457756,1,0.0986832536542242,0.0097383845517839,37,16715.781856075933,Q3_large,451.77788800205224
mfy4tHyLbHNqiOe3U3R2,"Will Tesla Vehicle production q4 2023 exceed 500,000?",0.0,0,0.0,0.0,26,10517.765600483648,Q3_large,404.529446172448
MxAshbSCOqBmTQssTp1b,"Will Tesla Vehicle production Q1 2024 exceed 500,000?",0.0,0,0.0,0.0,21,12841.948793075291,Q4_sophisticated,611.5213710988234
cdN5gcP68N,Will Tesla announce an FSD Licensing deal during Earnings/company update on 4/22/2025?,0.1757925695929345,0,0.1757925695929345,0.0309030275240867,20,2038.005192602804,Q2_small,101.9002596301402
19CWMxD5GzgnH6j4gR6K,Will tesla (TSLA) beat the current estimate of 0.67 $/share on the next earning on April 17 2024?,0.09,0,0.09,0.0081,14,714.0,Q1_retail,51.0
vk40JsqPzOKxmiFQskZx,"Will Tesla Vehicle deliveries Q1 2024 exceed 500,000?",0.0,0,0.0,0.0,14,13203.962341560851,Q4_sophisticated,943.1401672543465
U1hWS0hHe9A4WBlQN4AB,Will Tesla (TSLA) Report $25 Billion Or Higher In Revenue On Earnings Release 07/19/2023?,0.24,0,0.24,0.0576,10,275.6325433120385,Q1_retail,27.563254331203847
XqcUsnEk6pEFTgkmRvRu,Will Tesla beat on earnings October 18?,0.0,0,0.0,0.0,9,4760.202038265153,Q4_sophisticated,528.911337585017
